{
  "schema_version": "1.0",
  "lesson_context": {
    "subject": "วิทยาศาสตร์",
    "age_band": "ประถมปลาย",
    "learning_goal": "ใช้ผลการทดลองเพื่ออธิบายปรากฏการณ์",
    "constraints": [
      "อุปกรณ์จำกัด",
      "ไม่มีอินเทอร์เน็ตบางวัน"
    ]
  },
  "observations": [
    {
      "statement": "บางคนยังไม่ได้ลงมือทดลอง (สมมติ)",
      "status": "needs-verification"
    }
  ],
  "teacher_choice": "ทดลองใช้การหมุนบทบาท",
  "plans": {
    "normal": "กลุ่มละสี่บทบาทหมุนเวียนและบันทึกผล",
    "disrupted": "ใช้ชุดตารางข้อมูลที่ระบุว่าเป็นข้อมูลฝึก วิเคราะห์ด้วย CER แบบออฟไลน์"
  },
  "evidence_next_time": [
    "บันทึกว่าแต่ละกลุ่มหมุนบทบาทครบหรือไม่โดยไม่ระบุชื่อนักเรียน",
    "ตัวอย่างเหตุผลอธิบายหลักฐานแบบไม่ระบุตัวบุคคล"
  ],
  "privacy_note": "ข้อมูลตัวอย่างสังเคราะห์ทั้งหมด ไม่มีข้อมูลส่วนบุคคล"
}